{
  "snitt_key": "se2_to_se1",
  "snitt_label": "SE2 to SE1",
  "from_zone": "SE2",
  "to_zone": "SE1",
  "country": "SE",
  "current_capacity_mw": 3300,
  "current_capacity_period": "2021-2023",
  "targets": [
    {"target_year": 2030, "capacity_mw": 3300},
    {"target_year": 2035, "capacity_mw": 5500},
    {"target_year": 2040, "capacity_mw": 6500},
    {"target_year": 2045, "capacity_mw": 7500}
  ],
  "narrative_note": "Southbound across snitt 1. The largest target jump in the table — capacity grows from 3300 MW today to 7500 MW by 2045 to enable transferring power south from SE2 surplus areas to support load growth.",
  "source_doc_key": "svk_nup_2026_2035",
  "source_page": 29,
  "extraction_method": "llm_extracted",
  "extraction_run_id": "2026-05-03-svk-nup-4.4-v1",
  "extraction_prompt_version": "v1.0",
  "confidence_tier": "observed"
}
